SampleName	OriginalSampleName	SiteName	Country	Longitude	Latitude	Elevation	LocationReliability	LocationNotes	AreaOfSite	SampleContext	SiteDescription	VegDescription	SampleType	SampleMethod	AgeBP	AgeUncertainty	ispercent	Notes	EMPD_version	Publication1	DOI1	Publication2	DOI2	Publication3	DOI3	Publication4	DOI4	Publication5	DOI5	Worker1_Role	Worker1_LastName	Worker1_Initials	Worker1_FirstName	Worker1_Address1	Worker1_Address2	Worker1_Email1	Worker1_Email2	Worker1_Phone1	Worker1_Phone2	Worker2_Role	Worker2_LastName	Worker2_Initials	Worker2_FirstName	Worker2_Address1	Worker2_Address2	Worker2_Email1	Worker2_Email2	Worker2_Phone1	Worker2_Phone2	Worker3_Role	Worker3_LastName	Worker3_Initials	Worker3_FirstName	Worker3_Address1	Worker3_Address2	Worker3_Email1	Worker3_Email2	Worker3_Phone1	Worker3_Phone2	Worker4_Role	Worker4_LastName	Worker4_Initials	Worker4_FirstName	Worker4_Address1	Worker4_Address2	Worker4_Email1	Worker4_Email2	Worker4_Phone1	Worker4_Phone2	Temperature	Precipitation	okexcept
Tonkov_r1	P-1	Pirin Moutains	Bulgaria	23.378519	41.664875	1100	A			forest undefined		near beach forest with groups of Ostrya carpinifolia, Betula pendula and artificial plantation of Pinus sylvestris	moss	hand picking		A	False		EMPD2											R	Tonkov	S.	Spassimir	"Sofia University ""St. Kliment Ohridski"", Department of Botany, Laboratory of Palynology, 8 Dragan Tzankov blvd., Sofia-1164, Bulgaria"		stonkov@abv.bg		359-2-8167314																																-1.4,-0.5,3.2,7.6,12.7,16.0,17.7,17.4,14.7,9.4,4.3,0.3,-0.53,7.83,17.03,9.47,8.45	38.0,43.0,47.0,59.0,68.0,64.0,50.0,42.0,38.0,45.0,52.0,50.0,131.0,174.0,156.0,135.0,596.0	
Tonkov_r2	P-2	Pirin Moutains	Bulgaria	23.412239	41.672908	1500	A			forest undefined		mixed coniferous-deciduous forest, Picea abies (35%), Pinus sylvestris (35%), Abies alba (15%), single trees of Betula pendula, Salix sp/, Alnus glutinosa, Fagus sylvatica.	moss	hand picking		A	False		EMPD2											R	Tonkov	S.	Spassimir	"Sofia University ""St. Kliment Ohridski"", Department of Botany, Laboratory of Palynology, 8 Dragan Tzankov blvd., Sofia-1164, Bulgaria"		stonkov@abv.bg		359-2-8167314																																-4.3,-3.7,0.6,5.3,9.2,13.1,14.9,14.5,12.7,7.3,1.9,-2.2,-3.4,5.03,14.17,7.3,5.77	44.0,50.0,53.0,67.0,73.0,70.0,54.0,48.0,39.0,44.0,52.0,54.0,148.0,193.0,172.0,135.0,648.0	
Tonkov_r3	P-3	Pirin Moutains	Bulgaria	23.417786	41.672986	1600	A			forest undefined		mixed coniferous forest, Picea abies (45%), Pinus sylvestris (45%), single trees of Abies alba, undergrowth of vaccinium myrtillus	moss	hand picking		A	False		EMPD2											R	Tonkov	S.	Spassimir	"Sofia University ""St. Kliment Ohridski"", Department of Botany, Laboratory of Palynology, 8 Dragan Tzankov blvd., Sofia-1164, Bulgaria"		stonkov@abv.bg		359-2-8167314																																-4.8,-4.2,0.3,5.3,8.7,12.5,14.4,14.0,12.5,7.0,1.5,-2.7,-3.9,4.77,13.63,7.0,5.38	45.0,51.0,54.0,69.0,74.0,71.0,54.0,49.0,39.0,44.0,52.0,55.0,151.0,197.0,174.0,135.0,657.0	
Tonkov_r4	P-4	Pirin Moutains	Bulgaria	23.422489	41.674447	1720	A			forest undefined		pure forest of Picea abies	moss	hand picking		A	False		EMPD2											R	Tonkov	S.	Spassimir	"Sofia University ""St. Kliment Ohridski"", Department of Botany, Laboratory of Palynology, 8 Dragan Tzankov blvd., Sofia-1164, Bulgaria"		stonkov@abv.bg		359-2-8167314																																-4.8,-4.2,0.3,5.3,8.7,12.5,14.4,14.0,12.5,7.0,1.5,-2.7,-3.9,4.77,13.63,7.0,5.38	45.0,51.0,54.0,69.0,74.0,71.0,54.0,49.0,39.0,44.0,52.0,55.0,151.0,197.0,174.0,135.0,657.0	
Tonkov_s1	RL-1	Rila Mountains	Bulgaria	23.470942	42.123756	2300	A			scattered trees/shrubs		subalpine belt, herbaceous vegetation with scattered groups of Pinus mugo	moss	hand picking		A	False		EMPD2											R	Tonkov	S.	Spassimir	"Sofia University ""St. Kliment Ohridski"", Department of Botany, Laboratory of Palynology, 8 Dragan Tzankov blvd., Sofia-1164, Bulgaria"		stonkov@abv.bg		359-2-8167314																																-8.0,-7.4,-3.5,2.1,4.3,7.6,9.7,9.7,8.5,3.2,-2.0,-6.2,-7.2,0.97,9.0,3.23,1.5	53.0,61.0,66.0,82.0,82.0,82.0,61.0,56.0,40.0,38.0,48.0,61.0,175.0,230.0,199.0,126.0,730.0	
Tonkov_t1	RL-A	Rila Mountains	Bulgaria	23.42	42.217022	1750	A					Mixed coniferous community of Picea abies. The proportions of the main tree species near the sampling site were Picea abies (30 %), Pinus peuce Griesb. (19 %) and P. mugo Turra (51 %). Single trees of P. sylvestris L. and Betula pendula Roth were also found.	moss	hand picking		A	False		EMPD2											R	Tonkov	S.	Spassimir	"Sofia University ""St. Kliment Ohridski"", Department of Botany, Laboratory of Palynology, 8 Dragan Tzankov blvd., Sofia-1164, Bulgaria"		stonkov@abv.bg		359-2-8167314																																-5.3,-4.5,-0.2,4.8,8.7,12.5,14.3,14.0,11.9,6.5,0.9,-3.3,-4.37,4.43,13.6,6.43,5.02	41.0,50.0,54.0,70.0,81.0,83.0,63.0,56.0,43.0,41.0,51.0,51.0,142.0,205.0,202.0,135.0,684.0	
Tonkov_t2	RL-B	Rila Mountains	Bulgaria	23.414167	42.220939	1600	A					Coniferous community of Picea abies (97 %), with some admixture of Abies alba (3 %).	moss			A	False		EMPD2											R	Tonkov	S.	Spassimir	"Sofia University ""St. Kliment Ohridski"", Department of Botany, Laboratory of Palynology, 8 Dragan Tzankov blvd., Sofia-1164, Bulgaria"		stonkov@abv.bg		359-2-8167314																																-5.1,-4.2,0.3,5.3,9.2,13.0,14.8,14.5,12.4,6.8,1.2,-3.0,-4.1,4.93,14.1,6.8,5.43	40.0,49.0,53.0,68.0,81.0,82.0,63.0,56.0,43.0,42.0,51.0,50.0,139.0,202.0,201.0,136.0,678.0	
Tonkov_t3	RL-C	Rila Mountains	Bulgaria	23.426944	42.230392	1450	A					Mixed coniferous community, composed of Picea abies (72 %) and Abies alba (28 %). Single trees of Salix caprea L. were also present.	moss	hand picking		A	False		EMPD2											R	Tonkov	S.	Spassimir	"Sofia University ""St. Kliment Ohridski"", Department of Botany, Laboratory of Palynology, 8 Dragan Tzankov blvd., Sofia-1164, Bulgaria"		stonkov@abv.bg		359-2-8167314																																-4.5,-3.6,0.7,5.5,9.8,13.6,15.4,15.0,12.7,7.2,1.7,-2.4,-3.5,5.33,14.67,7.2,5.92	40.0,48.0,51.0,67.0,79.0,81.0,63.0,55.0,42.0,42.0,51.0,50.0,138.0,197.0,199.0,135.0,669.0	
